Fecha	Actividad
2020-11-08	Cambio en la temperatura de ventilación - 28ºC
2020-11-14	Lavado del plástico del techo del invernadero
2020-11-20	Instalación de cañuelas en los tubos de calefacción 
2020-11-28	Cambio en la temperatura de ventilación - 24ºC Dia - 17ºC Noche
2020-12-17	Ajustes en pantalla, ventilación y calefacción a partir de reunión con asesor de Svensson
2020-12-29	Se independiza manejo del riego por expansión del Priva
2020-12-03	Retanqueo de gas
2021-01-06	Cambio apertura máxima de ventana al viento a 50% - Consultor Svensson
